"Title","Artist","ReviewBody","AlbumRating","AlbumFeelingRating","SongAvg","AlbumArt","Blurb","NextUpText","DatePosted","Listen1","Listen2","Listen3"
"A Beautiful Lie","30 Seconds to Mars","Now this is the album I was thinking of when I saw the first 30STM album pop up. The songs _The Kill_ and _From Yesterday_ were all over the radio when this album came out, like you couldn't escape them at all. While the first album from 30STM was a more progressive metal sound, this album seem to forgo both the metal and progressive stint from that album and move distinctly into the alternative realm; probably where the money is at compared to progressive and metal. The singles still definitely hold up, albeit not quite as high as I remember, but they were still very good. What this album does carry over from their first, is the spacey quality. The tracks sound very open, or airy, and that mixed with some of the oppressive riffs, really do a good job of setting the scene. Even though this album moves more into that alternative realm, in some ways its almost more ambitious than the first album. But with that ambition not every lands. So while not a fantastic album, still a pretty good one. This also marks the end of the **number/symbol** albums and we are now in the **A** territory.","3","3","3","\\OPENMEDIAVAULT\Media\Music\30 Seconds To Mars\A Beautiful Lie\Cover.jpg","More alternative, its probably garbage, but I liked it 10 years ago!","NEXT UP:  '64-'95 by Lemon Jelly  It's drug music!","2020-12-18T10:15:03.670155","2020-12-10","2020-12-11","2020-12-12"
"'64-'95","Lemon Jelly","A concept well shown is happening within this album. Each track is titled a year aka the title, the year is important here because that is when the sampled tracks were created. So basically this album is a showcase of specific samples how you can create something new with the old. This album generally starts off a little on the droning side for me, it has an unnecassary talking track to start it off, and then builds into a cosntant rising action to kind of set the tone for whats to come. But other than that the start of the album is rather slow. It does start to pick up after the halfway point with some tracks that will definitely be making it a more heavy rotation. The sole reason I bought this album years ago, was for _'64 aka Go_, this track has a groovey, mystical kind of quality to it. It feels as though you are on a quest traveling through the Desert. It might also not be instantly noticable, but the vocal sample is from William Shatner.","3","3","3.2","\\OPENMEDIAVAULT\Media\Music\Lemon Jelly\'64-'95\Cover.jpg","It's drug music!","NEXT UP:  A Broken Frame by Depeche Mode  looking forward to diving back into this band","2020-12-21T10:00:02.072903","2020-12-17","2020-12-18","2020-12-19"
"A Broken Frame","Depeche Mode","Oh Depeche Mode, the originators of synth pop as we know it and you can definitely see the origins here. The ablum starts out on a bit of a slow note with _Leave in Silence_, but it slowely builds throughout the track, not to some grand crescendo, but definitely enough to keep your interest throughout. The energy stays at that mellow, yet still dancy level in the next track _My Secret Garden_. _Monument_ starts out with this intrigueing beat to start off with. At this point I was starting to lose a bit of interest after multiple listens, feeling that there was something missing from the composition. Then _See You_ comes on, and picks up the pace by quite a lot. _Satallite_ almost feels like an electronic reggea song, its got the skanking bum-pause-bum-bum thing going one (there's got to be a better way to describe that). _The Meaning of Love_ is just a classic, right up there with _Just Can't Get Enough_. Now the following track _Further Excerpts From: My Secret Garden_ is rather interesting, it almost feels like a part 2 instead of a revisit of the main song. It really takes the melancholy this album has been brewing and takes it one notch darker instead. Its also interesting that it wasn't placed after the song is revisiting. Overall the album does a great job of being *A Mood*, but sometimes it leaves a little to be desired, even though its a solid album all around.","3","3","3","\\OPENMEDIAVAULT\Media\Music\Depeche Mode\A Broken Frame\Cover.png","looking forward to diving back into this band","NEXT UP:  A Deathgrip On Yesterday by Atreyu  oh fuck yeah, I haven't listed to this album in like 10 years","2020-12-25T10:05:57.597312","2020-12-17","2020-12-18","2020-12-19"
"A Death-grip On Yesterday","Atreyu","A classic album. I think I wore the cd out when I was in middle/high school. That first sharp intake of breath on _Creature_ always gets me in a mood. This album is full of angst, from the vocals to the guitars, to every fiber of every song. Even back when I first started listening to this album; I usually really dislike the more melodic-chanting type of chorus; I fell in love with choruses, they act as a nice break from the more heavy screaming centric verses. I think with _The Theft_, being the standout single from this album, always fell a bit short for me. I think the magic of the melodic/hardcore mashup didn't really work as well with this track as it has done with other tracks. Now _Ex's and Oh's_ on the other hand, what a catchy track. Everything about that track gets me absolutely pumped up. The song _My Fork in the Road..._ even though it got a three has a sick guitar solo that is defintiely worth checking out. Over all the album is just a bunhc of nostalgia for me, I still like it, but I don't know if I would like it as much if I didn't love it so much as a kid.","4","4","4","\\OPENMEDIAVAULT\Media\Music\Atreyu\A Death-Grip On Yesterday\Cover.jpg","oh fuck yeah, I haven't listed to this album in like 10 years","NEXT UP:  A Jacknife to a Swan by The Mighty Mighty Bosstones  Woo more ska!","2020-12-28T12:46:57.932689","2020-12-24","2020-12-25","2020-12-26"
"A Jackknife to a Swan","The Mighty Mighty Bosstones","Oh The Mighty Mighty Bosstones, a ska classic. I don't think I had ever actually listened to this album all the way through before. It definitely has that early 2000's feel to it, got some slightly pop-punkier vibes than some of their earlier work. The album starts out strong with _A Jackknight to a Swan_. _Mr. Moran_ opens with a sample from some old movie or something, and I don't know why but I am always a sucker for those. _You Gotta Go!_ is: ""Pick it up, Pick it up, Pick it up!"" the song. The ablum definitely sllows down quite a bit with _Everybody's Better_. This song defintely has a kind of rocksteady vibe to it. The next two tracks, _Sugar Free_ and _I Want My City Back_, both take it back up to the ska punk that you would expect of the Bosstones. Nothing really much to say, they are solid tracks but don't really change, or mix anything up. I will say the mix of the ska punk sound with the rocksteady vibes does do a good job of breaking the album the album. I personally am not such a big fan of the rocksteady but it is nice in small doses. The opening of _The Old School Off the Bright_ starts out as kind of a bepop beat, I wish it stuck with it a bit longer before transitioning into the punk banger. _The Punch Line_ is definetly one of the highs of this album, just a classic Bosstones track. The Organ on _Shit Outta Luck_ is always a highlight for me, I don't know what it is about that organ sound but I can't get enough of it. Overall this album is a ska classic, it doesn't really do anything special but its by no means bad.","3","3","3","\\OPENMEDIAVAULT\Media\Music\Mighty Mighty Bosstones, The\A Jackknife To A Swan\Cover.jpg","Woo more ska!","NEXT UP:  A Lesson in the Abuse of Information Technology by The Menzingers  While this isn't my favorite album from them, the album is still pretty good","2021-01-01T10:00:11.425381","2020-12-24","2020-12-25","2020-12-26"
"A Lesson in the Abuse of Information Technology","The Menzingers","The first full length album from Pennsylvania based Menzingers. This album is a classic example of mid 2000's punk. The album definitely starts out strong, but really comes into it's own during the titular track. You can definitely see the roots of some of their most popular tracks beginning to take hold here. _Ave Maria_ my favorite track off the album, it has this nostalgic quality to it. _Coal City Blues_ just drops the pace of the album, I know its basically a requirment for punk bands to have atleast one or two slow songs but they are always my least favorite on the album. The next track, _Keychain_, brings us right back to the action. that first line always gets me hyped ""I feel my teeth turning black..."". _Even for an Eggshell_ is rather interesting as well, its a song about Hamlet, and its a really cool take. _Richard Coury_ is the second of like four slow tracks on this album, this songs saving grace is that it gets really good about halfway through. _Straight to Hell_ has got the early markings of _I don't want to be an Asshole Anymore_ written all over it. _Cold Weather Gear_ is really just a sample over some acoustic strumming, there is some actual track in here but its doewsn't have enough going on for me. The last hurrah of the album, _Clap Hands Two Guns_, tries to get us back to the highs of the earlier portion of the album, but with a harder edge to it. Overall this album is fantastic, it has a few rough spots which should probably drop it to a three, but I think the highs are worth the jump to a four.","4","4","3","\\OPENMEDIAVAULT\Media\Music\Menzingers, The\A Lesson in the Abuse of Information Technology\Cover.jpg","While this isn't my favorite album from them, the album is still pretty good","NEXT UP:  A Picture of Finn Farting by Renard  Oh boy, some more lapfox trax. Lets hope I like this better than Bandetto","2021-01-04T10:00:20.228157","2020-12-31","2021-01-01","2021-01-02"
"A Picture of Finn Farting","Renard","I believe this album is a bunch of unreleased/unfinished tracks that I donloaded from Renard for free. Typically I don't like the commentary on songs like these but _THE RETRO COMEBACK BAD EXPERIENCE_ has a commentary intro that I don't particularily mind. I believe this is more about the fact that the song is really fucking oitherwise. I think the track _GOT MY PONY SPAM FOR YOU_ would have easiliy jumped to a 4 if it didn't have such a long intro about hand farts. Besides the talking portions this album is a fast paced gem. _WHO'S READY FOR THE BASEMENT_ has quite the littany of samples throughout, it's almost a game in and of itself to try and pick out all the samples. The track _VS PSYCHOLOGY_ which is a stevie wonder cover, has this really cool spooky, ambient sound to it. The next few tracks are good, but you c an defitely see their unfinished nature. Everything starts to pick back up for me when _YOU GOT CURVES, SHE GOT CURVES_ starts playing. The final track, _DARK TONY HAWK IS BORN_ is the gem on this album. It is such a great track, featuring a sample from Adventure Time of Marceline singing about her father. Overall its a solid little mixtape featuring some uncut/unfinished work but I think the pieces themselves are good enough hold their own.","3","3","3","\\OPENMEDIAVAULT\Media\Music\Renard\A Picture of Finn Farting\Cover.jpg","Oh boy, some more lapfox trax. Lets hope I like this better than Bandetto","NEXT UP:  A Place Where the Sun is Silent by Alesana  Now this... this is a Grade-A lowus band. I remember falling off after the first few albums but still really good","2021-01-08T10:00:18.022232","2020-12-31","2021-01-01","2021-01-02"
"A Place Where the Sun is Silent","Alesana","We have another rock opera style album. This is a post-hardcore edition with the premise focusing on Dante's inferno. The album starts out, _The Dark Wood of Error_, with a lilting melody featuring a duet between the male and female singers. Almost haunting in a way, it really sets the mood for the rest of the album. The first actual track of the album is, _A Forbidden Dance_, they definitely toned down the screaming for this album, its still there for sure, but just not as often as some previous albums. I'm changing my opinion on _Hand in Hand with the Damned_ this track fucking rocks. The build up for the next track, _Beyond the Sacred Glass_ is mindblowing as well. The guitar solo pretty much makes this song. The next track _The Temptress_ has this chorus that I cannot stand in this kind of genre, thats the reason for the low star rating. Another stand out is _Circle VII: Sins of the Lion_, the chorus on this song just gets me so hyped up. The next Track _Vestige_ is a nice break from the hardcore sound, although I think the instrumental version is better. _Lullaby of the Crucified_ marks a fantastic end to Act One, being a rock opera this album is broken up into two eight song acts. After a bit of a lull, _Lybyrinth_ brings us right back to the action. The hardcore screaming a nice compliment to some of the softer elements. After _Welcome to the Vanity Faire_ the album starts to shift towards a more carnival-esque sound, there has to be a better descriptor than that. Overall this is another great album, I think this might be my favorite Alesana album period.","4","4","3","\\OPENMEDIAVAULT\Media\Music\Alesana\A Place Where the Sun is Silent\Cover.jpg","Now this... this is a Grade-A lowus band. I remember falling off after the first few albums but still really good","NEXT UP:  A Series of Sneaks by Spoon  classic Texas Indie","2021-01-11T10:00:22.732692","2021-01-07","2021-01-08","2021-01-09"
"A Series of Sneaks","Spoon","The second full length album by Spoon. Classic indie rock at it's finest. Spoon is unironically the soundtrack to the years 2000-2005 for me. I think this is one of those albums that you can play anywhere and people will get into it. This is one of those albums thats hard to get into specifics with, since all the tracks feel the same, but are distinctly different. But tracks like _Reservations_ are really a standout. It's such a groovey track. _30 Gallon Tank_ is just rising action the song. All the songs on the album are just fun songs. We see things slowing down a bit when we get to _Metal Detektor_. I actually changed my mind on _June's Foreign Spell_ while listening to it for the review. That song is actually a four and not a three. Overall not much to say, but give this album a listen if you get a chance.","3","3","3","\\OPENMEDIAVAULT\Media\Music\Spoon\A Series of Sneaks\Cover.jpg","classic Texas Indie","NEXT UP:  A Thousand Leaves by Sonic Youth  It's not their best album, but its not bad","2021-01-15T10:00:22.732692","2021-01-07","2021-01-08","2021-01-09"
"A Thousand Leaves","Sonic Youth","This is one of the sonic youth albums I never really got around too, Their earlier albums are the ones I've spent the most time on. The album does start out a little rough for me with _Contre Le Sexisme_, being mostly a silence/noise track. Things start picking up with _Sunday_, definitely harkens a lot to the 90s indie sound but does a nice job of not feeling too repetitive. When the bridge kicks back up towards the middle of _Wildflower Soul_ I feel it. I think this album definitely has some high highs, but also some low lows. I guess that is one of the issues with Art Rock, you can find some really cool sounds but you can never really stick with them for too long. Most of the songs do a nice job of jumping between a softer side and then a harder edgier side. Overall I think the album has some good pieces, but I don't think it will make it as an everyday staple.","3","3","2.7","\\OPENMEDIAVAULT\Media\Music\Sonic Youth\A Thousand Leaves\Cover.jpg","It's not their best album, but its not bad","NEXT UP:  A Weird Exits by Thee Oh Sees  The second half of a 2 part ep, The album art is by Robert Beaty and is awesome","2021-01-18T10:00:16.344679","2021-01-14","2021-01-15","2021-01-16"
"A Weird Exits","Thee Oh Sees","I have probably listened to this album about thrity times before I ever bought it. Such a wild and fun ride. This is still on the more lofi-gargey side before they moved in a more progressive route for their later albums. The first track _Dead Man's Gun_ definitely sets the stage, it's nice and jammy with sick solo right in the middle. _Ticklish Warrior_ carries the momentum and kind of adds a Wall of Sound type ascetic. The next track _Jammed Entrance_ is this albums jam track. It's a good jam, but nothing special as well. _Plastic Plant_ kicks everything into overdrive. That guitar riff at the beginning just makes you want to mosh. _Gelatinous Cube_ keeps that energy high, I think I just like loud and fast guitars, which is waht this album is mostly. The album generall slows down quite a bit after that last track. _Unwrap the Friend, Pt.2_ is another jam track, still fun but more carries the energy rather than build it up or down. The jamming continues with _Crawl Out From the Fall Out_; it's more of a noise-y thing than a jammy track, but about halfway through it starts to get a bit more instrumental. Finally _The Axis_ almost has a religious quality to it. Feels like the end of an acid trip when your ramblings are starting to sound prophetic. The organ defintely helps in that regard. Overall I think this is a fucking fantastic album, not for everyone but for a fan of Dwyer or Oh Sees its a must listen.","4","4","3.75","\\OPENMEDIAVAULT\Media\Music\Thee Oh Sees\A Weird Exits\Cover.jpg","The second half of a 2 part ep, The album art is by Robert Beaty and is awesome","NEXT UP:  about by HYI  I remember this album being hyped up, but I never got around to it","2021-01-22T10:00:16.593834","2021-01-14","2021-01-15","2021-01-16"
"about","HYI","Two weeks in a row we have albums starting with nothing/noise tracks at the beggining. For the most part _about_ is a rather chill affair. _ephemera_ takes a couple minutes to pick up, but when it does, holy shit does it pick up. We ride that high from the last minute or so right into _she spoke of it_; a banger all the way through, I think it's my favorite song on the album overall. We slow things down a bit when move to _inside out star tree_ and amp up the glitchiness when we get to _end of ice_. I really like _end of ice_ but I wish it would go someplace instead of just building a mood. THe track _animal crossing_ has this really interesting eastern sound to it. I really can't decide if _animal crossing_ or _she spoke of it_ are my favorites but defintiely two standouts of the album. Overall I think this is a good entry point for the new fursona, hyi, but I really can't wait to see what happens in their second album.","3","3","2.9","\\OPENMEDIAVAULT\Media\Music\hyi\about\Cover.png","I remember this album being hyped up, but I never got around to it","NEXT UP:  Acid Intraveneous by Renard + Adraen  more Lapfox trax, bring them on","2021-01-25T10:00:04.185081","2021-01-21","2021-01-22","2021-01-23"
"Acid Intraveneous","Renard vs Adraen","More Lap Fox Trax (or whatever it's going by now). Always a good time, I believe Renard is the sample, straight electronic fursona, but I don't remember what Adraen is off the top of my head. _Night Ride_ lives up to its name, this song would make a great addition to a driving game. The song is basically all rising action. The drum and base is strong with _Not So Bad_, it starts out a little slow for my taste but it definitely picks up the action. The next two tracks _You Goddamn Fish_ and _Way High_ are both a little on the slow side for me. _Physicallity_ is a really interesting track that uses a System of a Down sample. Really fun track. Overall the album is a short and fun, sample/jungle get down.","3","3","3.1","\\OPENMEDIAVAULT\Media\Music\Renard vs Adraen\Acid Intravenous\Cover.jpg","more Lapfox trax, bring them on","NEXT UP:  The Adolescents by The Adolescents  classic socal punk, this album is fantastic","2021-01-29T10:12:21.296241","2021-01-21","2021-01-22","2021-01-23"
"Adolescents","Adolescents","The first Album from Adolescents. This is **the** Socal Punk album. One of the greatest of all time. Every track is a fast throwdown that just makes you want to mosh. The first few tracks _I Hate Children_, _Who Is Who?_, _Wrecking Ball_, and _L.A. Girl_ are all great tracks, a little on the samesies side for most of them. They all feature that fast as a whip thrash sound. The album startes to really pick up for me during _Kids of the Black Hole_. The sound changes up a bit, its quite a bit longer at five and half minutes versus the one and half minute tracks preceding it. The slow build of the track, that leads into that solo is really something else, not something you were seeing out of a ton of punk bands at the time. _No Way_ starts out with that guitar solo to really bring the energy back up in preperation for the next track. _Amoeba_ is the track that got them famous. The track so good a record store named themselves after it. Such a catchy jam, I don't know a person that couldn't get it into. When you say thrash punk, you think Amoeba. Skipping a few tracks, _Democracy_ turns out to be really timeless, the same sentiments exist fourty years after this album came out. _No Friends_ is the next track on the list. This song got a four strictly for that solo towards the end. _Creatures_ has this energy, another fun track. Overall this album is one of the greatest, a little on the samesies side to warrent a five, but this is definitely going in heavy rotation","4","4","3.3","\\OPENMEDIAVAULT\Media\Music\Adolescents\Adolescents\Cover.png","classic socal punk, this album is fantastic","NEXT UP:  (Knight) by RQ  I wonder if this character is going to register correctly. THe answer is no","2021-02-01T10:00:08.513808","2021-01-28","2021-01-29","2021-01-30"
"(Knight)","RQ","RQ is the rebrand of Renard Queenstone, I think RQ is much catchier and was a good choice. First thing you might notice is that we are back in the symbols, well we actually have to jump back for a few albums till we fill out those sections. You also might notice that there is a thousand different symbols, this is what broke the bot a while ago. Starting off the first track is literally a second long, seriously why do artists do this stuff, it's not like there is a track quota on albums. For the most part this album is _fine_, nothing special and nothing terrible. That being said there are two tracks in particular that are really good. _THE DEMONS_ has this really interesting sample, presumadly from a televangelist, that plays throughout it. The followup up track _[Rush Coil]_, is also worth noting here. The mix of an organ with a trap beat is something I never knew I needed before now. Other than those two, the other tracks aren't bad, just nothing else worth saying. Overall it's a fun album that is definitely worth a listen.","3","3","3","\\OPENMEDIAVAULT\Media\Music\RQ\(Knight)\Cover.jpg","I wonder if this character is going to register correctly. THe answer is no","NEXT UP:  2YR, 40:28.649 by HALLEY LABS Associates  Again I have no idea what to expect","2021-02-05T10:00:09.393870","2021-01-28","2021-01-29","2021-01-30"
"2YR, 40:28.649","HALLEY LABS Associates","I don't think I've ever listened to an ""experiental"" album before. To me it just seemed like almost ambient electronica. For the most part this album is pretty chill, whith some fun upticks. _Cat Tail Lake_ is very much like that, the first half is pretty chill and ambient, but then it morphs into this bouncy jam track. It eventually leads to the track, _Wasn't All There_, which I do like, in parts. I usually kind of like the effect of the radio static, as if you are changing stations; but it's used to such an extent that it actually does the opposite for me here. Then we get to _Tweesee Smiled_ and what a track to go out on. It's got some heavy Dnb vibes, that breaks down into like a vgm guitar riff. After that transition it becomes an airy, trance song. Overall I don't think I like this album that much, but there are a few tracks that definitely make it worth while.","3","3","2.9","\\OPENMEDIAVAULT\Media\Music\HALLEY LABS Associates\2YR, 40-28.649\Cover.jpg","Again I have no idea what to expect","NEXT UP:  Adore by Smashing Pumpkins  90s classic band, I don't think I actually like them that much","2021-02-08T10:00:11.973592","2021-02-04","2021-02-05","2021-02-06"
"Adore","Smashing Pumpkins","I don't know if this was the best album to jump in to Smashing Pumpkins with. This album is very 90's alternative, but it does mix some electronic elements into it. The first two tracks _To Shiela_ and _Ava Adore_ are a little on the art house style for me, a little too slow as well. _Perfect_ is more inline with what I would expect from Smashing pumpkins. Then in _Daphne Descends_ it goes back to that moody electronic sound. The next series of tracks, aren't bad just a little on the boring side. This album feels very 90's at points, thats not necassarily a bad thing but it can be. The track _Appels + Oranjes_ leans very heavily into the electronic sound, almost going full on Moby Electronic. _Pug_ stays on the electronic bend that the previous track sets up, but is a lot more high enegery. _Annie-Dog_ starts out as a slow piano driven dirge, but slowely builds and builds over the course of its run time. Overall I don't think this album is bad, its just not really for me. The few standouts are the only thing holding this album at a three for me.","3","3","2.8","\\OPENMEDIAVAULT\Media\Music\Smashing Pumpkins\Adore\Cover.jpg","90s classic band, I don't think I actually like them that much","NEXT UP:  Adrenaline by Deftones  I love this band, but I don't remember this album at all","2021-02-12T10:02:22.036130","2021-02-04","2021-02-05","2021-02-06"
