"Title","Artist","ReviewBody","AlbumRating","AlbumFeelingRating","SongAvg","AlbumArt","Blurb","NextUpText","DatePosted","Listen1","Listen2","Listen3"
"When Your Heart Stops Beating","+44","The first and only album from +44, starts off rather strong with _Lycanthrope_. The Energy of this song tells you that that you are in for a classic pop punk album, and it continues for a couple songs until you remember that half of the band is [Blink-182](../../Blink-182/Blink-182_Artist_Review.md) and their last album was [Blink-182](../../Blink-182/Blink-182/Blink-182_Album_Review.md)... The album drops off after _When your Heart Stops Beating_ moving into the more slow, experimental nature that is featured on _Blink-182_. The songs _Little Death_ and _No It Isn't_ are both about the breakup of _Blink-182_, while _Little Death_ isn't a bad song by any means it can start to drag a bit on repeat listens. _No It Isn't_ on the other hand is fantastic build from the more experimental tracks back to the higher energy the album started with. _Make You Smile_ is the absolute best song on the album, the duet nature makes this song an absolute joy.  Overall I think the album is a solid mix of pre-breakup _Blink-182_ and a new evolution of pop punk. The album starts high then dips, but on the oathg the end starts to ramp, in my opinion, higher than the start. Sometimes the more experimental nature feels to drag, but overall I think the album is a solid 3 out of 5","3","3","3","\\OPENMEDIAVAULT\Media\Music\+44\When Your Heart Stops Beating\Cover.jpg","","Oh and Next weeks album is a blast from the past  Justice - (Cross)","2020-09-27T10:00:00,000","2020-09-22","2020-09-23","2020-09-24"
"(Cross)","Justice","Justice, I haven't thought about this band or this album in years, coming back to it though it doesn't really hold the same place for me. The album starts out with _Genesis_ its a nice buildup, telling you what to expect for the next 48 minutes, but feels as though it takes a bit too long to get to its point, this was a tough one since I do like it with the album as a whole but I don't think it holds up on its own merits. _Let There Be Light_ has some interesting charactists, but the extended distorted organ starts to wear thing fairly quickly. The transition between the previous and the next track, _D.A.N.C.E_ is also a little wonky. The radio changing effect between songs is always a little jarring for me, but I guess its not a bad way to transiiton from a slower song to a classic pop bop. Probably the only actual song people know off this album, it is quite the fun dance track bringing in funk elements with a classic 4 on the flour house beat. I do n the whole enjoy this song, but it can be a bit saccharine at times. Next up is _Newjack_ and while it does fit with the ascethitic of the album; the consistant high pass filters make it a fairly annoying listen on its own. _Phantom_ is a bit on the noise-y side, which I typically like, but it felt almost a little Jam-y which is not quite what the rest of the album feels like. What else needs to be said about _Phantom Part II_ that hasn't been covered by _Phantom_, it is just a continuation of the previous track and really should just be combined. _Valentine_ is a nice palette cleanser from the previous blocks of tracks. I feel its needed, but the song on its own is not really that great. This album so far might sound like a big miss rather than a nice trip down memory lane, that is until it hits with the next block of tracks, starting with _TThhee PPaarrttyy_. I have mixed feelings about this song, it is quite a great buildup to the next block of tracks, but as a solo play it doesn't really hold its own. _DVNO_ on the other hand, is a straight up jam. Such a fun bop, it almost jumped itself up a whole place. I know what I said about the previous noise-y, jam-y track, but _Stress_ owns it. It almost has a sythwave vibe, even though this album is about 15 years to young for that genre. _Waters Of Nazareth_ continues on the trend of the previous track, but picks up the pace a bit. The ending few tracks of this album are really what solidify the entire albums rating. Finally _One Minute to Midnight_ closes the album out, a nice respite from the last few tracks. Would be a lot higher if it didn't do that stupid minute of dead space at the end. Overall I do enjoy the album but it is on the low end of 3 out of 5. The strength of the last half of the album really carries it higher.","3","3","2.5","\\OPENMEDIAVAULT\Media\Music\Justice\(Cross)\Cover.jpg","Oh and Next weeks album is a blast from the past","NEXT UP:  its (ONe) by The Panic Channel  Woo, get ready for some but rock","2020-10-05T10:00:00,000","2020-09-28","2020-09-29","2020-09-30"
"(ONe)","The Panic Channel","This album is absolutely atrocious. `But Rock` at its... finest? Do you listen to [_Foo Fighters_](../../Foo%20Fighters/Foo_Fighters_Artist_Review.md) and wish they were more Generic? Then this is the band for you. Unlike most reviews where I listen 3-4 times to get ratings and really see what I think about the album, this time I think 2 listens is really enough. Ranging anywhere from ""this is fine"" to ""please make it stop"" this is not an album I will ever revisit. Its so bad in fact that I am seriously contemplating removing it from my library entirely.","1","1","1","\\OPENMEDIAVAULT\Media\Music\Panic Channel, The\(ONe)\Cover.jpg","Woo, get ready for some but rock","NEXT UP:  *.WAV SLAVE by BANDETTO","2020-10-12T10:00:00,000","2020-10-05","2020-10-06","2020-10-07"
"*.WAV SLAVE","BANDETTO","It turns out that I do not have as high a tolerance for Breakcore as I thought I did. The album overall isn't bad but I would like it better if I had a dance pad or some other foux instrument to go along with it. I feel like I don't have too much to say about each of the individual tracks since they blend together so much. With few standouts like _barf city_ and _amnesiac_ the album is fun but its really nothing special. A good listen if you are in the mood to party, but as an album to just listen to its just mediocre. ","3","3","2","\\OPENMEDIAVAULT\Media\Music\BANDETTO\-.WAV SLAVE\BANDETTO - -.WAV SLAVE - cover.png","I never wrote a blurb for this one","NEXT UP:  ...And Out Come the Wolves by Rancid","2020-10-19T10:00:00,000","2020-10-15","2020-10-16","2020-10-17"
"...And Out Come The Wolves","Rancid","This album hops from absolute banger to banger. Not a dead spot to be found. Starts out strong with _Maxwell Murder_, pulling into the power chord chorus of _The 11th Hour_. The ablum starts to really pick up with _Time Bomb_, its got that catchy chorus that breaks right into that classic ska breakdown. _Olympia WA_ has that shredding solo to prove that they can do more than just power chords. You can really feel the punk roots showing in _Lock, Step & Gone_, sounds just like a Clash song turned just a little more modern. And the titular track of the album, _Junkie Man_, even though the title is just part of of the outro of the song. _Listed M.I.A._ brings home how different, yet the same every track on this album is. I am definitely showing my bias towards loud, fast, punk music here. _Ruby Soho_ The best track on the album, even though Punk isn't supposed to be chorus heavy, Ska is on the other hand. So far this also marks the first 5 star song rating I have given out, hopefully got some more coming. The next few songs: _Daily City Train_, _Journey to the End of East Bay_, and _She's Automatic_; are all not bad songs, but nothing worth really pointing out. _Old Friend_ really starts to brings back the classic ska stroke.  _Disorder and Disarray_ Is in my opinion the last hurrah of this album, everything after is still good but nothing super memorable.  Overall this has been my favorite album of the relisten so far. This album hits every chord for a fun, ska-punk, album should. This album is definitely going back into heavy rotation.","4","4","3","\\OPENMEDIAVAULT\Media\Music\Rancid\And Out Come the Wolves\Cover.jpg","","NEXT UP:  [ Movements ] by Solar Fields  I think this is a video game soundtrack, idk?","2020-10-26T10:00:00,000","2020-10-22","2020-10-23","2020-10-24"
"[ Movements ]","Solar Fields","So Heres the hard part about reviewing Ambient Albums, I like ambient but only in certain situations and moods. So while I do enjoy this album, it is not something I could see myself really listening to all that often. The Album does start strong with a nice long build on _Sol_, then kind of chills out and meanders a while for tracks like _Circles of Motion_ and _Discovering_. _The Stones are not too Busy_ starts to pick it back up over its 10 minute duration, but then again starts to chill out again. I have a hard time of coming up with new things to say about an ambient track, becuase you aren't really supposed to _Listen_ to them, so much as they are supposed to be background noise to help you focus or put you in a mood. Its the same way with a lot of Post rock for me as well. _Das Bungalow_ is pulling me back in, I like a bit of up-tempo with my ambient. I could very easily see this album being the OST for a space puzzle game. Its got that nice open sound while still holding you in the moment, it has a nice air-y breath-y sound qualities as well.","3","3","2","\\OPENMEDIAVAULT\Media\Music\Solar Fields\[ Movements ]\Cover.jpg","I think this is a video game soundtrack, idk?","NEXT UP:  10,000 Days by Tool  y'all are seriously sleeping on Tool","2020-11-02T10:00:00,000","2020-10-29","2020-10-30","2020-10-31"
"10,000 Days","Tool","This album was my introduction to Tool. I liked it at the time but I didn't quite appreciate it until I got older. The way they bend progressive tendancies with metal is jaw dropping. The opening track, _Vicarious_, has this awesome slow build until it gets into the song proper. I think a lot of people just associate Tool with the people who like Tool, instead of necassarily appreciating the music for what it is. The album meanders a bit for a few tracks, it has an interesting build with _Wings For Marie_ but the payoff in _10,000 Days_ isn't quite enough for me. The Everything changes when we get to the song _The Pot_ this song is fantastic, and the first Tool song I ever heard. remember how I said everything was changing, that was wishful thinking. The next two tracks _Lipan Conjuring_ and _Lost Keys (Blame Hofmann)_, are just noise/intermission tracks. Have I ever mentioned how much I hate when artists do this. HOOO BOYYY. Next up is _Rosetta Stoned_, eleven minutes and eleven seconds of pure jam, if it was shorter it might get the coveted five out of five. The album keeps doing this flip flop of really solid tracks with just noise, it would be different if the noise tracks led into the others, but they seem to be there just to be there. _Right in Two_ brings the album back right into that groove. The last track on the album, _Viginti Tres_, is another just noise track.  I really like the album overall, but the noise tracks really hamper it from being a fantastic album.","3","4","2.6","\\OPENMEDIAVAULT\Media\Music\Tool\10,000 Days\Cover.jpg","y'all are seriously sleeping on Tool","NEXT UP:  1039 SMoothed Out Slappy Hours by Green Day  it's basically a compilation of all their early albums and eps","2020-11-06T10:00:00,000","2020-10-29","2020-10-30","2020-10-31"
"1039 Smoothed Out Slappy Hours","Green Day","This album is a compilation of Green Days Frist album and a few of their early EPs. As far as it goes it is a great listen, theres a few notable tracks, but for the most part it is just bog standard Punk. _The Judge's Daughter_ is a notable standout for me, the shredding solo at the end really kicks the song up a notch. HOLY SHIT, I take it all back. The second half of this album fucking kicks ass, _Dry Ice_ to _The One I Want_ are absolute bangers, this album might skew higher than my initial reactions. Nice mix of catchy but also in your face. You can definitely see how Green Day will transition to pop punk as they get older, but right now this album is exactl waht Late 80s, early 90s punk was about. This album really shows the musicianship of the group, it starts off with power chord after power chord, but then it evolves over the course of the album and you can see those roots and then see how it grows past them.","3","3","3.1","\\OPENMEDIAVAULT\Media\Music\Green Day\1039 Smoothed Out Slappy Hours\Cover.jpg","it's basically a compilation of all their early albums and eps","NEXT UP:  13 by Blur  this is not the album with Track 2","2020-11-09T10:00:00,000","2020-11-05","2020-11-06","2020-11-07"
"13","Blur","I've never actually listened to this Blur album all the way through before. I can't say I've ever really found myself so wishy washy on an album before. I seemed to alternate every track, with either liking it or hating it. _Coffee & TV_ was surprising hit on the album for me, but apart from that it was pretty touch and go. _Optigan 1_ was your standard noise interlude, which I hate, and then _Tender_, seven minutes of a boring slow song, no thank you. Overall I didn't hate this album, but I didn't really find anything special in it that I really liked.","2","2","2.3","\\OPENMEDIAVAULT\Media\Music\Blur\13\Cover.jpg","this is not the album with Track 2","NEXT UP:  18 by Moby  I wonder if this is the album with the Bourne Theme Song (it is)","2020-11-13T10:00:00,000","2020-11-05","2020-11-06","2020-11-07"
"18","Moby","I've listened to a bunch of moby tracks before this, never a full album, and liked what I've listened too. This album feels very swing-y too me; in the sense that it swings from good to bad throughout the album. It starts out pretty space-y with _We Are All Made of Stars_ but slowely transitions to another just boring slow track _The Great Escape_. After this track the album starts to build up again until it gets to _Extreme Ways_ this was the Bourne trilogy theme song and what initially got me into Moby, and its followed up with _Jam for the Ladies_ which I really like but doesn't fit the theme of the album at all. Unfortunately after this the album really drops off for me. If it wasn't for the two songs I mentioned above this album would be a solid 2, but with those additions it just barely eeks out a 3.","3","3","2.3","\\OPENMEDIAVAULT\Media\Music\Moby\18\Cover.jpg","I wonder if this is the album with the Bourne Theme Song (it is)","NEXT UP:  1983 by Flying Lotus  The first album, arguably one of the greatest showings of his raw talent","2020-11-16T10:00:00,000","2020-11-12","2020-11-13","2020-11-14"
"1983","Flying Lotus","The first full length album for Flying Flotus. It shows off his talent, but still leaves some room to grow. Overall this album has clear space-y connatations. This album is a mix of finding a groove and then leaving the groove when it starts to get boring. The titular track, _1983_, is a build on the groove, it takes its time to find it and then slowely builds and adds new elements to it over the course of its duration. The complex beat structure with the glitch like fill; makes for a very interesting listen. As soon as you think you understand the tracks, you find something new to enjoy. _Babble_, while not a bad track, I feel is just too short and doesn't really accomplish what it sets out to. One of my few issues with the album is some of the transistions are a little too hard. _Unexpected Delight_ really lives up to its name. The volicity of the backing track makes combined with the haunting vocals by Laura; make for a hypnotic track that doesn't let go of your attention.","3","3","3","\\OPENMEDIAVAULT\Media\Music\Flying Lotus\1983\Cover.jpg","The first album, arguably one of the greatest showings of his raw talent","NEXT UP:  200 Million Thousand by The Black Lips  I've never listened to this album in its entirety before","2020-11-20T10:07:00,000","2020-11-12","2020-11-13","2020-11-14"
"200 Million Thousand","The Black Lips","I had never listened to this album all the way through before. Its a great entry to the garage rock genre in my library. On my first listen I found myself really liking the album. I think on the whole it does better than the individual tracks would suggest, which I don't think is uncommon for this genre. What is a misnomer on this album is the songs I gave a 2 star too. While I enjoyed all these tracks I feel like on a shuffle I would most likely skip them. But this album is fuzzy, warm, and a great jam album. Every track gets you in a groove and then just holds you there until it decides its time to move on. _Short Fuse_ is very reminiscient of a [The Hives](../../Hives,%20TheHives_Artist_Review.md) track, but a little more on the lo-fi side. _Meltdown_, the hidden track on the album (based MusicBee filters out the minutes of silence), would have been a lot lower if I couldn't have filterd the white noise out.","4","4","3.1","\\OPENMEDIAVAULT\Media\Music\Black Lips, The\200 Million Thousand\Cover.jpg","I've never listened to this album in its entirety before","NEXT UP:  30 Seconds to Mars by 30 Seconds to Mars  DOOOOOONNN''''''TTTT BRRREEEAAAKKK MMEEEE DOOOWWNNNN, MMMARRRYYY MMMEEE (turns out this is not that album)","2020-11-23T10:00:08.413456","2020-11-19","2020-11-20","2020-11-21"
"30 Seconds to Mars","30 Seconds to Mars","Going into this album, I could really only remember their single off their next album [A Beautiful Life](../A%20Beautiful%20Lie/A_Beautiful_Lie_Album_Review.md), _the Kill_, and its more alternative leanings. This album on the other hand has much more of a progressive blend to its sound than I remember of the next album. The song _Edge of the Earth_ is the first track that makes me realize that this album is something special. They managed to make the sound very open, while still keeping that heaviness associated with metal. _Fallen_ really amps up on the space theme. For a first showing from 30 Seconds to Mars, this is a great showing. While not as much to talk about since the album fits the theme it sets pretty well. Overall this album is fantastic and is definitely going back into the rotation.","4","4","3.1","\\OPENMEDIAVAULT\Media\Music\30 Seconds To Mars\30 Seconds To Mars\Cover.jpg","DOOOOOONNN''''''TTTT BRRREEEAAAKKK MMEEEE DOOOWWNNNN, MMMARRRYYY MMMEEE (turns out this is not that album)","NEXT UP:  21st Century Breakdown by Green Day  I hate 21 guns, but let's do this","2020-11-29T09:36:41.363882","2020-11-26","2020-11-27","2020-11-28"
"21st Century Breakdown","Green Day","This album should have been called `Billie Armstrong Wants to Make The Black Parade`. I think this album was so supposed to be reminiscient of the the entire 2000-2010 decade. Listening through you can tell the obvious influences with _Murder City_ being something off of [The Black Parade](../../My%20Chemical%20Romance/The%20Black%20Parade/The_Black_Parade_Album_Review.md). Off the same album _21st Century Breakdown_ feels like it wants to be that bombastic anthem that _Welcome to the Black Parade_ is. _Know Your Enemy_ is reminiscient of some of their own earlier work, like something off of [Warning](../Warning/Warning_Album_Review.md). Even the next track _Viva La Gloria!_ sounds familair to their older work, specifically [American Idiot](../American%20Idiot/American_Idiot_Album_Review.md). Skipping a bit ahead _Last of the American Girls_ sounds like the intro song to a mid 2000s teen girl movie. _Restless Heart Syndrome_, even though it has such a ripping solo, it just takes too long to get anywhere that I don't find myself wanting to wait to get to the good part. _Horseshoes and Handgrenades_ feels like a straight rip off of [The Hives](../../Hives,%20The/The_Hives_Artist_Review.md). 	This is the second album by Green Day that is supposed to be a ""Punk Rock Opera"", the first being _American Idiot_, but this album feels a bit disengenous to me. Maybe I am being too harsh on this album; if you think it about it another way this album came out at the end of the decade so maybe they were just trying to highlight the previous decades punk, emo, and emo anthems into a rock opera. To me though I think it feels more like they are apeing the sounds they are trying to pay homage too.","2","2","1.9","\\OPENMEDIAVAULT\Media\Music\Green Day\21st Century Breakdown\Cover.jpg","I hate 21 guns, but let's do this","NEXT UP:  40oz. to Freedom by Sublime  This is not the one with all the bangers","2020-11-30T10:00:07.132488","2020-11-26","2020-11-27","2020-11-28"
"40oz. to Freedom","Sublime","The first album from Sublime. Who knew they would be such a break out hit after this. The album doesn't feel very cohesive throughout, seeing as the genre shifts each track. This album did a few standouts that I don't think I had listened too before, such as: _We're Only Gonna Die for our Arrogance_, _54-46 That's My Number/Ball and Chain_, and _What Happened_. The mix of sampling on this album is a reall interesting, typically somethign I really enjoy and that holds true here as well. It was fun to relisten to this album and hear some tracks I haven't listened to in years. Although songs like _Badfish_ or _Smoke Two Joints_ have just been played so many times growing up that Idk if I can really listen to them anymore. But this album deserves it's four star rating not much to say other than who hasn't listened to this album and who doesn't think it's good.","4","4","3.2","\\OPENMEDIAVAULT\Media\Music\Sublime\40oz. to Freedom\Cover.jpg","This is not the one with all the bangers","NEXT UP:  44 by The Mayan Factor  Imagine Tool, but Weirder","2020-12-04T10:00:02.889284","2020-11-26","2020-11-27","2020-11-28"
"44","The Mayan Factor","My intial thoughts on the album was that it was just another Tool clone, but that is not entirely true. The album has a more experimental feel to it, then even Tool does. The whole album has a really ancient feel to it, with the chanting and marracas. in some songs it has this nice blend of the progressive with some alternative bent to it. Some songs almost feel like Tool x R.E.M.. _44_ is definitely stronger in the first half then the second half. While I don't have a ton to say about this album, I think it's really good and is definitely worth checking out.","3","3","2.9","\\OPENMEDIAVAULT\Media\Music\Mayan Factor, The\44\Cover.jpg","Imagine Tool, but Weirder","NEXT UP:  '64-'95 by Lemon Jelly  It's drug music!","2020-12-11T11:37:34.644246","2020-12-03","2020-12-04","2020-12-05"
"99 songs of Revolution, Vol 1","Streetlight Manifesto","An Album of Covers, the project was initally started by Bandits of the Acoutstic Revolution. Seeing as this album was called Volume 1 I was kind of assuming there would be a volume 2 but I have not read anything about a potential volume 2 anywhere. Each track on this album is a cover, redone in the signature stye of Streetlight Manifesto. The covers are, in order: Mason Jennings, Squirrel Nut Zippers, Radiohead, Bad Religion, The Dead Milkmen, NOFX, Paul Simon, Bandits of the Acoustic Revolution, Paul Simon, Luis Jordan, and The Postal Service. The Cover of the Bad Religion song will be really interesting to compare to the orignal since I have that track in the library somehwere. What's really interesting about this album is they do a good job of making the covers sound different, but they still have the soul of the original. I think the cover/pairing that does this the best is Hurt by NIN that was covered by Johnny Cash. The song Just, even without knowing that it was a Radiohead song, you can still hear the chord progressions and the fill they tend to use on their songs bleed through the cover as well. What really drew me to this album was their cover of The Postal Service's Such Great Heights, there are thousands, I mean, thousands of covers of this song, but Streetlight actually managed to do the track in a different style so it feels different and unique but you can still see the soul. We've been having a great streak with the strong reviews, let's hope that trend continues.","4","4","3.5","\\OPENMEDIAVAULT\Media\Music\Streetlight Manifesto\99 Songs of Revolution, Vol 1\Cover.jpg","Imagine Tool, but Weirder","NEXT UP:  '64-'95 by Lemon Jelly  It's drug music!","2020-12-11T11:37:34.644246","2020-12-03","2020-12-04","2020-12-05"
"#501","MidiCronica","So I was initally very interested in this album since Midicronica did the end track for Samurai Champloo. Samurai Champloo always had a fantastic soundtrack, blending a more traditional Japanese sound with the modern, at the time, hip hop sound. Unfortunately I am missing a few tracks on this album, but with my reception to the other tracks, I am not sure if they would have helped the score on this review overall. What gets me about this album is that I like the beats behind the tracks, but its one of the guys in the group has a really grating sound to me and they seem to feature him in every single song. This album also does the classic hip hop thing of including a ton of sample tracks or skits, which hurt this album overall in my opinion. Then you get to the track _San Francisco_ and it all comes back, the groovey nature of the track just puts you in a good mood. It might just be my initial bias towards the show, but this track would have made a fantastic closing track. Well here ends the streak of strong reviews, I have a few tracks that I will keep in mind going forward, but overall I think this album will stay buried in the library.","2","2","2","\\OPENMEDIAVAULT\Media\Music\MidiCronica\#501\Cover.jpg","They did some of the Samurai Champloo music","NEXT UP:  A Beautiful Lie by 30 Seconds to Mars  More alternative, its probably garbage, but I liked it 10 years ago!","2020-12-16T12:06:50.293507","2020-12-10","2020-12-11","2020-12-12"
